<?xml version="1.0" encoding="us-ascii"?>
<!DOCTYPE softpkg SYSTEM "../dtd/softpkg.dtd">
<!--
    Generated by Zeligsoft Component Enabler 2.0.2 (Build: 200510131317)
    http://www.zeligsoft.com
-->
<softpkg id="DCE:93fe82d9-691e-422d-aaf9-bccc65b6de6d" name="soundCardPlayback" type="sca_compliant" version="">
    <title>Sound card playback device</title>
    <description />
    <author>
        <name>OSSIE Team</name>
        <company>VA Tech/MPRG</company>
        <webpage>http://ossie.mprg.org/</webpage>
    </author>
    <descriptor name="">
        <localfile name="xml/soundCardPlayback/soundCardPlayback.scd.xml" />
    </descriptor>
        <propertyfile type="PRF">
            <localfile name="xml/soundCardPlayback/soundCardPlayback.prf.xml" />
        </propertyfile>
    <!--[Implementation Sound_out_linux]-->
    <implementation id="DCE:4b903f0e-0c2c-401b-89fc-3beaa82359f0" aepcompliance="aep_compliant">
        <code type="Executable">
            <localfile name="bin/soundCardPlayback" />
        </code>
        <os name="Linux" version="5.5.1" />
        <processor name="x86" />
    </implementation>
</softpkg>
