<?xml version="1.0" encoding="us-ascii"?>
<!DOCTYPE softpkg SYSTEM "../dtd/softpkg.dtd">
<!--
    Generated by Zeligsoft Component Enabler 2.0.2 (Build: 200510131317)
    http://www.zeligsoft.com
-->
<softpkg id="DCE:6be771f4-4ce3-4b4c-9e7c-10e88eeece7f" name="GPP" type="sca_compliant" version="">
    <title />
    <description>General purpose processor device</description>
    <author>
        <name>Philip Balister</name>
        <company>MPRG</company>
        <webpage>www.mprg.org</webpage>
    </author>
    <descriptor name="">
        <localfile name="xml/GPP/GPP.scd.xml" />
    </descriptor>
    <!--[Implementation GPP_linux]-->
    <implementation id="DCE:0ef71fab-731d-4ee1-a528-a6da2207e0c5" aepcompliance="aep_compliant">
        <code type="Executable">
            <localfile name="bin/GPP" />
        </code>
        <compiler name="gcc" version="3.4" />
        <humanlanguage name="english" />
        <os name="Linux" version="5.5.1" />
        <processor name="x86" />
    </implementation>
</softpkg>
