<?xml version="1.0" encoding="us-ascii"?>
<!DOCTYPE softpkg SYSTEM "../dtd/softpkg.dtd">
<!--
    Generated by Zeligsoft Component Enabler 2.0.2 (Build: 200510131317)
    http://www.zeligsoft.com
-->
<softpkg id="DCE:f171d2db-0e8f-4a82-a687-19f76a64c079" name="soundCardCapture" type="sca_compliant" version="">
    <title />
    <description>This device uses ALSA (www.alsa-project.org) to capture audio from the sound card</description>
    <author>
        <name>OSSIE Team</name>
        <company>VA Tech/MPRG</company>
        <webpage>http://ossie.mprg.org/</webpage>
    </author>
    <descriptor name="">
	    <localfile name="xml/soundCardCapture/soundCardCapture.scd.xml" />
    </descriptor>
    <propertyfile type="PRF">
  	    <localfile name="xml/soundCardCapture/soundCardCapture.prf.xml" />
    </propertyfile>
    <!--[Implementation Sound_in_linux]-->
    <implementation id="DCE:cfbeaba2-026c-46bd-98db-7f86ff80030d" aepcompliance="aep_compliant">
        <code type="Executable">
            <localfile name="bin/soundCardCapture" />
        </code>
        <os name="Linux" version="5.5.1" />
        <processor name="x86" />
    </implementation>
</softpkg>
