<?xml version="1.0" encoding="us-ascii"?>
<!DOCTYPE softpkg SYSTEM "../dtd/softpkg.dtd">
<!--
    Generated by Zeligsoft Component Enabler 2.0.2 (Build: 200510131317)
    http://www.zeligsoft.com
-->
<softpkg id="DCE:1d9783ae-677d-4150-887e-3d56761d4c37" name="USRP" type="sca_compliant" version="">
    <title />
    <description>Universal software radio peripheral</description>
    <author>
        <name>Ossie Team</name>
        <company>Va Tech/MPRG</company>
        <webpage>http://ossie.mprg.org/</webpage>
    </author>
    <descriptor name="">
        <localfile name="xml/USRP/USRP.scd.xml" />
    </descriptor>
    <!--[Implementation USRPImplementation_linux]-->
    <implementation id="DCE:005a01c3-e469-4332-a4bd-a83b0159853e" aepcompliance="aep_compliant">
        <code type="Executable">
            <localfile name="bin/USRP" />
        </code>
        <os name="Linux" version="5.5.1" />
        <processor name="x86" />
    </implementation>
</softpkg>
