<?xml version="1.0" encoding="us-ascii"?>
<!DOCTYPE softpkg SYSTEM "../dtd/softpkg.dtd">
<!--
    Generated by Zeligsoft Component Enabler 2.0.2 (Build: 200510131317)
    http://www.zeligsoft.com
-->
<softpkg id="DCE:66a59f6f-e26a-412f-959b-7bcc383a80be" name="Decimate" type="sca_compliant" version="">
    <title>Decimator component, version 0.6.2</title>
    <description>Sample rate reduction by efficiently filtering and subsampling, v0.6.2</description>
    <author>
        <name>OSSIE Team</name>
        <company>Mobile and Portable Radio Research Group</company>
        <webpage>http://www.mprg.org</webpage>
    </author>
    <propertyfile type="PRF">
      <localfile name="xml/Decimator/Decimator.prf.xml" />
    </propertyfile>
    <descriptor name="">
        <localfile name="xml/Decimator/Decimator.scd.xml" />
    </descriptor>
    <!--[Implementation Decimate_linux]-->
    <implementation id="DCE:1aee5bc6-5149-4c58-a2ae-89fab9276719" aepcompliance="aep_compliant">
        <code type="Executable">
            <localfile name="bin/Decimator" />
        </code>
        <os name="Linux" version="5.5.1" />
        <processor name="x86" />
    </implementation>
</softpkg>
