<?xml version="1.0" encoding="UTF-8"?>
<!DOCTYPE softpkg SYSTEM "../dtd/softpkg.dtd">
<!--Created with OSSIE WaveDev Beta Version 0.6.0b-->
<!--Powered by Python-->
<softpkg id="DCE:5e399696-8249-11dc-9442-00123f63025f" name="RxDemo">
    <title/>
    <description>Receives and compares data generated by TxDemo; displays errors</description> 
    <author>
        <name>OSSIE Project</name> 
        <company>Mobile and Portable Radio Research Group</company> 
        <webpage>http://www.mprg.org</webpage> 
    </author>
    <propertyfile type="PRF">
        <localfile name="xml/RxDemo/RxDemo.prf.xml"/>
    </propertyfile>
    <descriptor>
        <localfile name="xml/RxDemo/RxDemo.scd.xml"/>
    </descriptor>
    <implementation id="DCE:5e3ad966-8249-11dc-a466-00123f63025f">
        <description>Linux implementation</description> 
        <code type="Executable">
            <localfile name="bin/RxDemo"/>
        </code>
        <processor name="x86"/>
    </implementation>
</softpkg>
